{
  "acr_id": "ACR-0003",
  "title": "Keep AI telemetry separate from financial ledger",
  "status": "needs-review",
  "requester": "control-tower",
  "date": "2026-09-19",
  "affected_modules": [
    "ai-gateway",
    "managed-ops"
  ],
  "problem": "Normalize Scout proposal ACR-02-002 for owner reconciliation.",
  "proposed_change": "Preserve existing usage-to-billing ownership: AI Gateway emits measurements; Managed Ops owns pricing, corrections, deduplication and ledger. Telemetry cannot become billing authority.",
  "alternatives": [
    "Defer adoption until affected owners supply contract and verification evidence."
  ],
  "contract_impact": "Proposed only; no accepted vendor or module boundary change.",
  "security_impact": "Candidate discovery is not authorization, commercial clearance, or runtime security verification.",
  "cost_schedule_impact": "Removes misrouted work; no paid service is purchased by this proposal.",
  "migration": "Apply only through reviewed owner contracts.",
  "rollback": "Keep current draft boundaries until proposal is accepted or superseded.",
  "evidence": [
    "https://github.com/ng549/ndgcv/blob/9a6d207c11380c0dfbf21f7f08b2f0a62feb96e9/nexus-v2/research/reuse-scout/PHASE-ONE-REUSE-SCOUT.md"
  ],
  "decision_owner": "Control Tower with affected module owners",
  "decision": null
}
